"A Song Unheard (Shadows Over England) Paperback – January 2, 2018",$10.99 ,Books > Christian Books & Bibles > Literature & Fiction,Roseanna M. White,764219278,416 pages,"Bethany House Publishers (January 2, 2018)",English,5.6 x 1 x 8.4 inches,13.3 ounces,4.7 out of 5 stars
"The First Man in Rome (In the Masters of Rome) Paperback – November 11, 2008",$6.75 ,Books > Literature & Fiction > Genre Fiction,Colleen McCullough,61582417,1123 pages,"Avon Books; 1st edition (November 11, 2008)",English,5.3 x 1.8 x 8 inches,2 pounds,4.4 out of 5 stars
"An Amish Winter: Home Sweet Home, A Christmas Visitor, When Winter Comes Mass Market Paperback – December 5, 2017",$6.21 ,Books > Christian Books & Bibles > Literature & Fiction,Amy Clipston,785217223,400 pages,"Zondervan (December 5, 2017)",English,4.2 x 1 x 6.8 inches,6.4 ounces,4.3 out of 5 stars
"Lilac Lane (A Chesapeake Shores Novel) Hardcover – October 17, 2017",$14.87 ,Books > Literature & Fiction > Genre Fiction,Sherryl Woods,778331334,352 pages,"MIRA; 1st edition (October 17, 2017)",English,6.4 x 1.2 x 9.2 inches,1.1 pounds,4.6 out of 5 stars
"Black Roses: The Mitchell Sisters Book Three Paperback – April 20, 2016",$12.99 ,Books > Romance > New Adult & College,Samantha Christy,1530601576,372 pages,"CreateSpace Independent Publishing Platform (April 20, 2016)",English,5.5 x 0.9 x 8.5 inches,1.2 pounds,4.7 out of 5 stars
"Here Comes the Sun (Butler, Vermont Series) Paperback – January 23, 2018",$12.61 ,Books > Literature & Fiction > Women's Fiction,Marie Force,1420148346,288 pages,"Zebra (January 23, 2018)",English,5.6 x 0.7 x 8.4 inches,12 ounces,4.7 out of 5 stars
"River Marked (Mercy Thompson, Book 6) (A Mercy Thompson Novel) Mass Market Paperback – January 31, 2012",$7.99 ,Books > Literature & Fiction > Genre Fiction,Patricia Briggs,9.78044E+12,304 pages,"Ace; Reprint edition (January 31, 2012)",English,4.2 x 0.8 x 6.8 inches,2.4 ounces,4.5 out of 5 stars
"Catching Caden Paperback – December 15, 2017",$12.29 ,Books > Romance > Contemporary,Samantha Christy,1979928959,400 pages,"CreateSpace Independent Publishing Platform (December 15, 2017)",English,5.5 x 1 x 8.5 inches,1.3 pounds,4.8 out of 5 stars
"Beautiful Disaster: A Novel (Beautiful Disaster Series) Paperback – August 14, 2012",$12.08 ,Books > Literature & Fiction > Women's Fiction,Jamie McGuire,1476712042,432 pages,"Atria Books; Original ed. edition (August 14, 2012)",English,5.3 x 1.1 x 8.2 inches,5.6 ounces,4.4 out of 5 stars
"The Lacemaker Paperback – January 2, 2018",$12.75 ,Books > Christian Books & Bibles > Literature & Fiction,Laura Frantz,800726634,416 pages,"Revell (January 2, 2018)",English,5.5 x 1 x 8.5 inches,12.2 ounces,4.7 out of 5 stars
"Burned: A Fever Novel Mass Market Paperback – November 24, 2015",$7.97 ,Books > Science Fiction & Fantasy > Fantasy,Karen Marie Moning,440246423,512 pages,"Dell (November 24, 2015)",English,4.2 x 1.1 x 6.9 inches,6.4 ounces,4.3 out of 5 stars
"The Loveliest Chocolate Shop in Paris (A Novel with Recipes) Paperback – February 4, 2014",$10.85 ,Books > Literature & Fiction > Women's Fiction,Jenny Colgan,1402284403,384 pages,"Sourcebooks Landmark (February 4, 2014)",English,5.5 x 1 x 8.2 inches,14.4 ounces,4.4 out of 5 stars
"Beautiful Oblivion: A Novel (The Maddox Brothers Series) Paperback – July 1, 2014",$10.76 ,Books > Literature & Fiction > Women's Fiction,Jamie McGuire,1476759588,336 pages,"Atria Books (July 1, 2014)",English,5.3 x 1 x 8.2 inches,9.9 ounces,4.5 out of 5 stars
"Beautiful Sacrifice: A Novel (Maddox Brothers) (Volume 3) Paperback – May 31, 2015",$14.99 ,Books > Romance > Contemporary,Jamie McGuire,1511847506,270 pages,"CreateSpace Independent Publishing Platform (May 31, 2015)",English,5.5 x 0.7 x 8.5 inches,13.4 ounces,4.5 out of 5 stars
"His Risk: The Amish of Hart County Paperback – March 6, 2018",$9.79 ,Books > Christian Books & Bibles > Literature & Fiction,Shelley Shepard Gray,62469150,288 pages,"Avon Inspire (March 6, 2018)",English,5.3 x 0.6 x 8 inches,7.2 ounces,4.6 out of 5 stars
"Threads of Suspicion (An Evie Blackwell Cold Case) Paperback – May 2, 2017",$11.19 ,Books > Christian Books & Bibles > Literature & Fiction,Dee Henderson,764219979,432 pages,"Bethany House Publishers (May 2, 2017)",English,5.5 x 1.1 x 8.3 inches,1.8 pounds,4.3 out of 5 stars
"Savage Paperback – February 9, 2018",$13.58 ,Books > Romance > Contemporary,Kira Blakely,1985228548,278 pages,"CreateSpace Independent Publishing Platform (February 9, 2018)",English,5 x 0.7 x 8 inches,13.1 ounces,4.7 out of 5 stars
"Buttons and Lace (Volume 1) Paperback – November 15, 2016",$13.99 ,Books > Romance > Romantic Suspense,Penelope Sky,1539340775,368 pages,"CreateSpace Independent Publishing Platform (November 15, 2016)",English,5.2 x 0.8 x 8 inches,11.2 ounces,4.6 out of 5 stars
"Blackmailed by the beast Paperback – February 9, 2018",$9.68 ,Books > Romance > New Adult & College,Georgia Le Carre,1910575798,226 pages,"Georgia Le Carre (February 9, 2018)",English,5 x 0.6 x 8 inches,10.9 ounces,4.5 out of 5 stars
"Beautiful Ruins: A Novel Paperback – April 2, 2013",$8.93 ,Books > Literature & Fiction > Genre Fiction,Jess Walter,61928178,337 pages,"Harper Perennial; Reprint edition (April 2, 2013)",English,5.3 x 0.8 x 8 inches,1.1 pounds,3.9 out of 5 stars
"A Light on the Hill (Cities of Refuge) Paperback – February 6, 2018",$10.99 ,Books > Christian Books & Bibles > Literature & Fiction,Connilyn Cossette,764219863,336 pages,"Bethany House Publishers (February 6, 2018)",English,5.5 x 0.8 x 8.5 inches,10.6 ounces,4.9 out of 5 stars
"The Choice Mass Market Paperback – April 1, 2009",$6.37 ,Books > Literature & Fiction > Women's Fiction,Nicholas Sparks,446618314,336 pages,"Vision; Reissue edition (April 1, 2009)",English,4.2 x 0.9 x 7 inches,8.8 ounces,4.5 out of 5 stars
"Sex, Not Love Paperback – January 15, 2018",$13.49 ,Books > Romance > Contemporary,Vi Keeland,1942215703,300 pages,"Vi Keeland (January 15, 2018)",English,5 x 0.8 x 8 inches,13.4 ounces,4.8 out of 5 stars
"Natural Witch (Magical Mayhem) (Volume 1) Paperback – January 25, 2018",$9.99 ,Books > Romance > Paranormal,K.F. Breene,1983641723,422 pages,"CreateSpace Independent Publishing Platform (January 25, 2018)",English,5 x 1.1 x 8 inches,1.2 pounds,4.7 out of 5 stars
"Beautiful Redemption: A Novel (The Maddox Brothers Series) (Volume 2) Paperback – January 27, 2015",$11.47 ,Books > Romance > Contemporary,Jamie McGuire,1502541858,266 pages,"CreateSpace Independent Publishing Platform (January 27, 2015)",English,5.5 x 0.7 x 8.5 inches,14.4 ounces,4.5 out of 5 stars
"American Wife: A Novel (Random House Reader's Circle) Paperback – February 10, 2009",$13.47 ,Books > Literature & Fiction > Genre Fiction,Curtis Sittenfeld,812975405,568 pages,"Random House Trade Paperbacks; First Printing edition (February 10, 2009)",English,5.2 x 1.3 x 8 inches,15.2 ounces,3.5 out of 5 stars
"Tiny Little Thing Paperback – February 2, 2016",$10.88 ,Books > Literature & Fiction > Genre Fiction,Beatriz Williams,425278867,416 pages,"Berkley; Reprint edition (February 2, 2016)",English,5.3 x 0.9 x 8 inches,12.6 ounces,4.2 out of 5 stars
"A Turn in the Road (A Blossom Street Novel) Mass Market Paperback – October 31, 2017",$7.62 ,Books > Christian Books & Bibles > Literature & Fiction,Debbie Macomber,778330419,384 pages,"MIRA; Reprint edition (October 31, 2017)",English,4.1 x 1 x 6.6 inches,1 pounds,4.7 out of 5 stars
"Born of Vengeance: The League: Nemesis Rising Mass Market Paperback – January 2, 2018",$8.99 ,Books > Science Fiction & Fantasy > Science Fiction,Sherrilyn Kenyon,125008279X,384 pages,"St. Martin's Paperbacks (January 2, 2018)",English,4.1 x 1 x 6.9 inches,6.4 ounces,4.0 out of 5 stars
"Lord John and the Brotherhood of the Blade: A Novel (Lord John Grey) Paperback – August 26, 2008",$14.14 ,Books > Literature & Fiction > Genre Fiction,Diana Gabaldon,385337507,528 pages,"Bantam; Reprint edition (August 26, 2008)",English,5.5 x 1.1 x 8.2 inches,1.4 pounds,4.4 out of 5 stars
"Wanted (Addicted Trilogy) (Volume 3) Paperback – July 7, 2015",$12.37 ,Books > Romance > Romantic Suspense,S. Nelson,1514808919,314 pages,"CreateSpace Independent Publishing Platform; 1 edition (July 7, 2015)",English,6 x 0.8 x 9 inches,1.2 pounds,4.5 out of 5 stars
"All the Little Lights Paperback – May 29, 2018",$9.99 ,Books > Literature & Fiction > Genre Fiction,Jamie McGuire,1503902781,444 pages,"Montlake Romance (May 29, 2018)",English,5.5 x 1 x 8.2 inches,1.4 pounds,
"The Awakening of Miss Prim: A Novel Paperback – July 8, 2014",$11.71 ,Books > Literature & Fiction > World Literature,Natalia Sanmartin Fenollera,1476734240,272 pages,"Atria Books; Translation edition (July 8, 2014)",English,5.3 x 0.8 x 8.2 inches,7 ounces,4.0 out of 5 stars
"Leopard's Blood (A Leopard Novel) Mass Market Paperback – October 24, 2017",$4.71 ,Books > Science Fiction & Fantasy > Fantasy,Christine Feehan,399583971,416 pages,"Berkley (October 24, 2017)",English,4.2 x 1.1 x 6.8 inches,7 ounces,4.4 out of 5 stars
"The Liar Mass Market Paperback – March 1, 2016",$5.98 ,Books > Literature & Fiction > Women's Fiction,Nora Roberts,1101989750,480 pages,"Berkley; 978-039917086-7 edition (March 1, 2016)",English,4.2 x 1 x 6.8 inches,7 ounces,4.3 out of 5 stars
"Lolita Paperback – February 1, 2018",$12.16 ,Books > Romance > Contemporary,Vladimir Nabokov,1977065341,227 pages,"Independently published (February 1, 2018)",English,6 x 0.6 x 9 inches,14.4 ounces,4.1 out of 5 stars
"Refuge Cove (The New Americana Series) Mass Market Paperback – January 30, 2018",$7.99 ,Books > Literature & Fiction > Women's Fiction,Janet Dailey,1420144901,304 pages,"Zebra; Reissue edition (January 30, 2018)",English,4.2 x 0.9 x 6.8 inches,5.1 ounces,4.2 out of 5 stars
"Holding Onto Forever (The Beaumont Series - Next Generation) (Volume 1) Paperback – September 25, 2017",$14.99 ,Books > Romance > Contemporary,Heidi McLaughlin,1977501230,292 pages,"CreateSpace Independent Publishing Platform (September 25, 2017)",English,5 x 0.7 x 8 inches,13.6 ounces,4.7 out of 5 stars
"Griffin and Sabine, 25th Anniversary Limited Edition: An Extraordinary Correspondence Hardcover – April 5, 2016",$17.73 ,Books > Literature & Fiction > Genre Fiction,Nick Bantock,145215595X,48 pages,"Chronicle Books; Anniversary, Limited edition (April 5, 2016)",English,8.5 x 0.8 x 8 inches,1.1 pounds,4.5 out of 5 stars
"Face the Fire (Three Sisters) Paperback – Deckle Edge, June 2, 2015",$13.60 ,Books > Literature & Fiction > Women's Fiction,Nora Roberts,425278131,384 pages,"Berkley (June 2, 2015)",English,5.6 x 1 x 8.3 inches,7.8 ounces,4.7 out of 5 stars
"Hunting Ground (Alpha & Omega, Book 2) Mass Market Paperback – August 25, 2009",$7.99 ,Books > Science Fiction & Fantasy > Fantasy,Patricia Briggs,044101738X,320 pages,"Ace (August 25, 2009)",English,4.2 x 0.8 x 6.8 inches,4.8 ounces,4.7 out of 5 stars
"Walking Disaster: A Novel (Beautiful Disaster Series) Paperback – April 2, 2013",$8.98 ,Books > Literature & Fiction > Women's Fiction,Jamie McGuire,1476712980,448 pages,"Atria Books; Original ed. edition (April 2, 2013)",English,5.3 x 1.2 x 8.2 inches,13.1 ounces,4.4 out of 5 stars
"Island Beneath the Sea: A Novel (P.S.) Paperback – April 26, 2011",$10.07 ,Books > Literature & Fiction > Genre Fiction,Isabel Allende,61988251,480 pages,"Harper Perennial; Reprint edition (April 26, 2011)",English,5.3 x 1.1 x 8 inches,4.8 ounces,4.5 out of 5 stars
"Some Kind of Hero: A Troubleshooters Novel Mass Market Paperback – February 27, 2018",$5.98 ,Books > Literature & Fiction > United States,Suzanne Brockmann,034554384X,400 pages,"Ballantine Books; Reprint edition (February 27, 2018)",English,4.2 x 1.1 x 6.9 inches,7.2 ounces,4.6 out of 5 stars
"An Honorable Seduction (The Westmoreland Legacy) Mass Market Paperback – May 8, 2018",$5.25 ,Books > Literature & Fiction > Genre Fiction,Brenda Jackson,1335971475,224 pages,"Harlequin Desire (May 8, 2018)",English,4.2 x 0.6 x 6.6 inches,4 ounces,
"The Other Side of the Pillow: A Novel Paperback – July 28, 2015",$11.50 ,Books > Literature & Fiction > United States,Zane,743499328,288 pages,"Atria Books; Reprint edition (July 28, 2015)",English,5.3 x 0.8 x 8.2 inches,9.9 ounces,4.4 out of 5 stars
"Come Back to Me (Blessings, Georgia) Mass Market Paperback – September 4, 2018",$7.99 ,Books > Literature & Fiction > Women's Fiction,Sharon Sala,1492663506,352 pages,"Sourcebooks Casablanca (September 4, 2018)",English,4.2 x 6.9 inches,1.1 pounds,
"Enchantress of Numbers: A Novel of Ada Lovelace Hardcover – December 5, 2017",$15.74 ,Books > Literature & Fiction > Genre Fiction,Jennifer Chiaverini,1101985208,448 pages,"Dutton (December 5, 2017)",English,6.4 x 1.4 x 9.3 inches,1.5 pounds,3.8 out of 5 stars
"Marry Me By Sundown Hardcover – July 10, 2018",$18.63 ,Books > Literature & Fiction > United States,Johanna Lindsey,1501162233,384 pages,"Gallery Books (July 10, 2018)",English,,1.7 pounds,
"Welcome to Moonlight Harbor (A Moonlight Harbor Novel) Mass Market Paperback – April 17, 2018",$7.99 ,Books > Literature & Fiction > Genre Fiction,Sheila Roberts,077836805X,400 pages,"MIRA (April 17, 2018)",English,4.1 x 1 x 6.6 inches,6.6 ounces,
"My Sweet Audrina Paperback – May 24, 2011",$8.98 ,Books > Teen & Young Adult > Literature & Fiction,V.C. Andrews,1442420189,464 pages,"Simon Pulse; 1st Edition edition (May 24, 2011)",English,5.5 x 1.2 x 8.2 inches,14.1 ounces,4.2 out of 5 stars
"Good Guys Love Dogs Paperback – May 6, 2013",$14.99 ,Books > Romance > Contemporary,Inglath Cooper,989110613,358 pages,"Fence Free Entertainment, LLC; 2nd Edition edition (May 6, 2013)",English,5.2 x 0.8 x 8 inches,14.1 ounces,4.5 out of 5 stars
"The King's Curse (The Plantagenet and Tudor Novels) Paperback – April 7, 2015",$10.48 ,Books > Literature & Fiction > Genre Fiction,Philippa Gregory,1451626126,640 pages,"Touchstone; Reprint edition (April 7, 2015)",English,5.2 x 1.3 x 8 inches,1.2 pounds,4.6 out of 5 stars
"A Duke in Shining Armor: Difficult Dukes Mass Market Paperback – November 28, 2017",$4.19 ,Books > Literature & Fiction > United States,Loretta Chase,62457381,400 pages,"Avon (November 28, 2017)",English,4.2 x 1 x 6.6 inches,6.7 ounces,4.3 out of 5 stars
"Sunstone Book One Hardcover – April 4, 2017",$29.68 ,Books > Comics & Graphic Novels > Graphic Novels,Stjepan Sejic,153430150X,376 pages,"Image Comics; Deluxe edition (April 4, 2017)",English,7.7 x 1 x 11.1 inches,2.6 pounds,5.0 out of 5 stars
"The Sleepwalker: A Novel (Vintage Contemporaries) Paperback – October 3, 2017",$12.83 ,"Books > Mystery, Thriller & Suspense > Thrillers & Suspense",Chris Bohjalian,804170991,304 pages,"Vintage; Reprint edition (October 3, 2017)",English,5.2 x 0.6 x 8 inches,7.8 ounces,4.1 out of 5 stars
"A Treacherous Curse (A Veronica Speedwell Mystery) Hardcover – January 16, 2018",$16.37 ,"Books > Mystery, Thriller & Suspense > Mystery",Deanna Raybourn,451476174,320 pages,"Berkley (January 16, 2018)",English,6.4 x 1.1 x 9.3 inches,1.1 pounds,4.6 out of 5 stars
"Dark Witch (The Cousins O'Dwyer Trilogy) Mass Market Paperback – January 24, 2017",$5.98 ,Books > Literature & Fiction > United States,Nora Roberts,515152897,352 pages,"Berkley; Reissue edition (January 24, 2017)",English,4.2 x 0.9 x 6.8 inches,5.6 ounces,4.4 out of 5 stars
"Eternal Seas Paperback – March 12, 2018",$16.99 ,Books > Romance > Contemporary,N. Christine Samuelson,150921979X,358 pages,"The Wild Rose Press (March 12, 2018)",English,5 x 0.7 x 8 inches,12.5 ounces,5.0 out of 5 stars
"Words from the Heart (An Amish Letters Novel) Paperback – February 13, 2018",$10.99 ,Books > Christian Books & Bibles > Literature & Fiction,Kathleen Fuller,718082567,320 pages,"Thomas Nelson (February 13, 2018)",English,5.5 x 0.8 x 8.4 inches,9.4 ounces,4.8 out of 5 stars
"Scarlett: The Sequel to Margaret Mitchell's ""Gone With the Wind"" Paperback – September 26, 2007",$14.99 ,Books > Literature & Fiction > Genre Fiction,Alexandra Ripley,446502375,832 pages,"Grand Central Publishing (September 26, 2007)",English,5.4 x 1.5 x 8.1 inches,1.5 pounds,4.3 out of 5 stars
"This Man (A This Man Novel) Paperback – October 22, 2013",$12.29 ,Books > Literature & Fiction > Genre Fiction,Jodi Ellen Malpas,1455578312,480 pages,"Forever (October 22, 2013)",English,5.2 x 1.2 x 8 inches,13.6 ounces,4.2 out of 5 stars
"Silent Sins (Lotus House) Paperback – April 3, 2018",$10.99 ,Books > Literature & Fiction > United States,Audrey Carlan,1943893144,,"Waterhouse Press (April 3, 2018)",English,,1.1 pounds,
"Possession Paperback – October 1, 1991",$11.37 ,Books > Literature & Fiction > Genre Fiction,A. S. Byatt,679735909,576 pages,"Vintage (October 1, 1991)",English,5.1 x 0.9 x 8 inches,1.1 pounds,4.1 out of 5 stars
"Thursdays at Eight: A Romance Novel Mass Market Paperback – November 28, 2017",$4.78 ,Books > Literature & Fiction > Genre Fiction,Debbie Macomber,778330443,384 pages,"MIRA (November 28, 2017)",English,4.2 x 1 x 6.6 inches,6.4 ounces,4.7 out of 5 stars
"Remember the Lilies (Thorndike Press Large Print Christian Historical Fiction) Hardcover – Large Print, August 12, 2015",$29.99 ,Books > Christian Books & Bibles > Literature & Fiction,Liz Tolsma,1410481220,542 pages,"Thorndike Press Large Print; Large Print edition (August 12, 2015)",English,5.8 x 1.2 x 8.5 inches,1.3 pounds,4.3 out of 5 stars
"The Big Book of Orgasms: 69 Sexy Stories Paperback – October 15, 2013",$14.36 ,Books > Literature & Fiction > Short Stories & Anthologies,Lady CheekyRachel Kramer BusselT. Fox Dunham,1573449636,242 pages,"Cleis Press (October 15, 2013)",English,5.2 x 1.2 x 7.2 inches,12.6 ounces,4.2 out of 5 stars
"Jane Eyre (Bantam Classics) Paperback – September 1, 1983",$2.86 ,Books > Literature & Fiction > Classics,Charlotte Bronte,553211404,492 pages,"Bantam Classics (October 1, 1983)",English,4.2 x 0.8 x 6.9 inches,8.8 ounces,4.4 out of 5 stars
"Ese Pervertido y Yo: Una montaña rusa de erotismo (Spanish Edition) (Spanish) Paperback – November 1, 2017",$11.68 ,Books > Literature & Fiction > Erotica,Perla Gizem,1979904235,178 pages,"CreateSpace Independent Publishing Platform (November 1, 2017)",Spanish,5 x 0.4 x 8 inches,6.7 ounces,4.8 out of 5 stars
"More Than Love You (More Than Words) (Volume 3) Paperback – February 13, 2018",$14.99 ,Books > Romance > Contemporary,Shayla Black,1936596474,312 pages,"Shelley Bradley, LLC (February 13, 2018)",English,6 x 0.7 x 9 inches,1.2 pounds,4.8 out of 5 stars
"My Once and Future Duke: The Wagers of Sin Mass Market Paperback – February 27, 2018",$7.99 ,Books > Literature & Fiction > United States,Caroline Linden,62672924,384 pages,"Avon (February 27, 2018)",English,4.2 x 1 x 6.6 inches,5.9 ounces,4.6 out of 5 stars
"Renegade Cowboy (Rocky Mountain Riders) Mass Market Paperback – December 19, 2017",$7.99 ,Books > Literature & Fiction > Genre Fiction,Sara Richardson,1455540811,352 pages,"Forever (December 19, 2017)",English,4.2 x 1.1 x 6.9 inches,5.9 ounces,4.6 out of 5 stars
"The Price of Salt Paperback – December 17, 2014",$8.95 ,Books > Gay & Lesbian > Literature & Fiction,Patricia Highsmith,486800296,256 pages,"Dover Publications; Reprint edition (January 14, 2015)",English,5.5 x 0.8 x 8.2 inches,7.2 ounces,4.3 out of 5 stars
"Wired (Buchanan/FBI) Hardcover – July 4, 2017",$19.06 ,Books > Literature & Fiction > Women's Fiction,Julie Garwood,525954465,320 pages,"Berkley; First Edition edition (July 4, 2017)",English,6.4 x 1.1 x 9.3 inches,1.2 pounds,4.2 out of 5 stars
"At First Sight Mass Market Paperback – June 25, 2013",$8.11 ,Books > Literature & Fiction > Genre Fiction,Nicholas Sparks,1455545384,368 pages,"Grand Central Publishing; Reissue edition (June 25, 2013)",English,4.2 x 1 x 6.8 inches,6.4 ounces,4.4 out of 5 stars
"Out of the Darkness (The Finnegan Connection) Mass Market Paperback – January 16, 2018",$5.07 ,"Books > Mystery, Thriller & Suspense > Thrillers & Suspense",Heather Graham,1335526161,256 pages,"Harlequin Intrigue (January 16, 2018)",English,4.2 x 0.7 x 6.6 inches,4.6 ounces,4.0 out of 5 stars
"No Other Duke Will Do (Windham Brides) Mass Market Paperback – November 7, 2017",$5.36 ,Books > Literature & Fiction > Genre Fiction,Grace Burrowes,145557001X,368 pages,"Forever (November 7, 2017)",English,4.2 x 1 x 6.8 inches,5 ounces,4.4 out of 5 stars
"The Gift: The Amish of Hart County Paperback – November 7, 2017",$8.26 ,Books > Christian Books & Bibles > Literature & Fiction,Shelley Shepard Gray,62469142,272 pages,"Avon Inspire (November 7, 2017)",English,5.3 x 0.6 x 8 inches,7 ounces,4.6 out of 5 stars
"When Calls the Heart: Hallmark Channel Special Movie Edition (Canadian West) Paperback – October 1, 2013",$11.77 ,Books > Christian Books & Bibles > Literature & Fiction,Janette Oke,076421229X,224 pages,"Bethany House Publishers; Movie ed. edition (October 1, 2013)",English,6.3 x 0.6 x 10.2 inches,8.8 ounces,4.5 out of 5 stars
"Shattered Memories (The Mirror Sisters Series) Mass Market Paperback – October 31, 2017",$7.19 ,Books > Literature & Fiction > Genre Fiction,V.C. Andrews,1476792380,432 pages,"Pocket Books; Reissue edition (October 31, 2017)",English,4.1 x 1 x 6.8 inches,7 ounces,4.4 out of 5 stars
"Flight of the White Wolf Mass Market Paperback – March 6, 2018",$6.47 ,Books > Literature & Fiction > United States,Terry Spear,1492655783,352 pages,"Sourcebooks Casablanca (March 6, 2018)",English,4.2 x 1.1 x 6.8 inches,5.9 ounces,3.9 out of 5 stars
"Shadows in the Night (The Finnegan Connection) Mass Market Paperback – October 17, 2017",$4.31 ,"Books > Mystery, Thriller & Suspense > Thrillers & Suspense",Heather Graham,1335721312,256 pages,"Harlequin Intrigue (October 17, 2017)",English,4.2 x 0.6 x 6.6 inches,4.3 ounces,4.2 out of 5 stars
"Beauty's Kingdom: A Novel in the Sleeping Beauty Series Paperback – April 19, 2016",$14.96 ,Books > Literature & Fiction > Erotica,Anne Rice,143108212,448 pages,"Penguin Books; Reprint edition (April 19, 2016)",English,4.8 x 1.1 x 8 inches,12 ounces,4.0 out of 5 stars
"Eat Pray Love: One Woman's Search for Everything Across Italy, India and Indonesia Paperback – June 29, 2010",$8.15 ,Books > Travel > Asia,Elizabeth Gilbert,143118420,352 pages,"Riverhead Books; Reissue edition (June 29, 2010)",English,5.4 x 0.7 x 8.4 inches,9.6 ounces,4.2 out of 5 stars
"The Prophecy (A Titan Novel) (Volume 4) Paperback – March 20, 2018",$13.99 ,Books > Romance > Paranormal,Jennifer L. Armentrout,194759172X,356 pages,"Jennifer L. Armentrout (March 20, 2018)",English,5.2 x 0.9 x 8 inches,1.1 pounds,
"The Sea of Tranquility: A Novel Paperback – June 4, 2013",$14.29 ,Books > Literature & Fiction > Genre Fiction,Katja Millay,1476730946,448 pages,"Atria Books; Reprint edition (June 4, 2013)",English,5.3 x 1.3 x 8.2 inches,12.6 ounces,4.7 out of 5 stars
"Shadowfever (Fever Series Book 5) Mass Market Paperback – August 30, 2011",$7.19 ,Books > Science Fiction & Fantasy > Fantasy,Karen Marie Moning,440244412,704 pages,"Dell; Reprint edition (August 30, 2011)",English,4.2 x 1.5 x 6.9 inches,12 ounces,4.7 out of 5 stars
"Bread of Angels Paperback – June 6, 2017",$9.17 ,Books > Christian Books & Bibles > Literature & Fiction,Tessa Afshar,1496406478,416 pages,"Tyndale House Publishers, Inc. (June 6, 2017)",English,5.3 x 1.1 x 8 inches,2.4 ounces,4.7 out of 5 stars
"Black Obsidian (Volume 1) Paperback – March 7, 2017",$12.35 ,Books > Romance > Contemporary,Victoria Quinn,1543281559,432 pages,"CreateSpace Independent Publishing Platform (March 7, 2017)",English,5.2 x 1 x 8 inches,1.2 pounds,4.6 out of 5 stars
"My Youth Romantic Comedy Is Wrong, As I Expected, Vol. 2 - light novel Paperback – May 23, 2017",$11.97 ,Books > Comics & Graphic Novels > Graphic Novels,Wataru Watari,031639601X,208 pages,"Yen On (May 23, 2017)",English,5.8 x 0.8 x 8.2 inches,13.4 ounces,4.7 out of 5 stars
"Seduction of a Proper Gentleman (Superior Collection) Paperback – Large Print, February 18, 2009",$5.68 ,Books > Literature & Fiction > United States,Victoria Alexander,1597229180,419 pages,"Kennebec Large Print; Large Print edition (February 18, 2009)",English,6 x 0.8 x 8.5 inches,1.1 pounds,3.7 out of 5 stars
"Autoboyography Hardcover – September 12, 2017",$13.29 ,"Books > Reference > Writing, Research & Publishing Guides",Christina Lauren,1481481681,416 pages,"Simon & Schuster Books for Young Readers (September 12, 2017)",English,5.5 x 1.3 x 8.2 inches,1.1 pounds,4.8 out of 5 stars
"Up In Smoke: A King Series Novel Paperback – February 16, 2018",$14.99 ,Books > Romance > Romantic Suspense,T.M. Frazier,1985001209,358 pages,"CreateSpace Independent Publishing Platform (February 16, 2018)",English,5.5 x 0.8 x 8.5 inches,1.2 pounds,4.8 out of 5 stars
"Brooklynaire Paperback – January 22, 2018",$15.00 ,Books > Romance > New Adult & College,Sarina Bowen,1942444540,296 pages,"Rennie Road Books (January 22, 2018)",English,5.2 x 0.7 x 8 inches,14.4 ounces,4.7 out of 5 stars
"Can You Keep a Secret?: A Novel Paperback – March 1, 2005",$12.80 ,Books > Literature & Fiction > Genre Fiction,Sophie Kinsella,385338082,368 pages,"Dial Press Trade Paperback; Reprint edition (March 1, 2005)",English,5.2 x 0.8 x 8.2 inches,10.4 ounces,4.3 out of 5 stars
"Misadventures of a Backup Bride (Misadventures Series) Hardcover – October 17, 2017",$10.99 ,Books > Literature & Fiction > United States,Shayla Black,194389342X,280 pages,"Waterhouse Press (October 17, 2017)",English,6 x 0.8 x 8 inches,9.9 ounces,4.6 out of 5 stars
"The Legend of Nimway Hall: 1750: Jacqueline (Volume 1) Paperback – March 4, 2018",$13.99 ,Books > Romance > Historical,Stephanie Laurens,1925559092,220 pages,"Savdek Management Pty Ltd; 1 edition (March 4, 2018)",English,5.5 x 0.5 x 8.5 inches,12.2 ounces,
