"X-Men: God Loves, Man Kills Paperback – May 11, 2011",$10.19 ,Books > Comics & Graphic Novels > Graphic Novels,Chris Claremont,785157263,96 pages,"Marvel (May 11, 2011)",English,6.6 x 0.2 x 10.2 inches,13.6 ounces,4.6 out of 5 stars
"The Warmaster (Gaunt's Ghosts) Hardcover – December 12, 2017",$17.70 ,Books > Science Fiction & Fantasy > Science Fiction,Dan Abnett,1784966150,352 pages,"Games Workshop (December 12, 2017)",English,6.3 x 1.4 x 9.5 inches,2.2 pounds,4.5 out of 5 stars
"Colorless Tsukuru Tazaki and His Years of Pilgrimage Paperback – May 5, 2015",$10.87 ,Books > Literature & Fiction > Genre Fiction,Haruki Murakami,804170126,336 pages,"Vintage Books (May 5, 2015)",English,5.1 x 0.8 x 8 inches,5.6 ounces,4.2 out of 5 stars
"Swan Song Mass Market Paperback – July 26, 2016",$6.83 ,Books > Literature & Fiction > Genre Fiction,Robert McCammon,1501131427,928 pages,"Pocket Books (July 26, 2016)",English,4.1 x 1.9 x 7.5 inches,1.2 pounds,4.6 out of 5 stars
"Age of Swords: Book Two of The Legends of the First Empire Paperback – January 30, 2018",$7.73 ,Books > Literature & Fiction > Action & Adventure,Michael J. Sullivan,110196538X,528 pages,"Del Rey; Reissue edition (January 30, 2018)",English,4.2 x 1.2 x 7.5 inches,9.8 ounces,4.3 out of 5 stars
"Back Blast (Gray Man) Paperback – January 3, 2017",$8.89 ,Books > Literature & Fiction > Action & Adventure,Mark Greaney,425282848,752 pages,"Berkley (January 3, 2017)",English,4.2 x 1.6 x 7.5 inches,14.1 ounces,4.7 out of 5 stars
"Call Me Zebra Hardcover – February 6, 2018",$16.32 ,Books > Literature & Fiction > Genre Fiction,Azareen Van der Vliet Oloomi,544944607,304 pages,"Houghton Mifflin Harcourt Trade (February 6, 2018)",English,6 x 1 x 9 inches,1.1 pounds,3.8 out of 5 stars
"The Silent Death (A Gereon Rath Mystery) Paperback – August 28, 2017",$13.84 ,"Books > Mystery, Thriller & Suspense > Thrillers & Suspense",Volker Kutscher,1910985643,540 pages,"Sandstone Press (August 28, 2017)",English,7.8 x 1.4 x 5.1 inches,15.5 ounces,3.4 out of 5 stars
"One for the Money (Stephanie Plum, No. 1) Paperback – February 1, 1996",$11.53 ,Books > Literature & Fiction > United States,Janet Evanovich,140252924,320 pages,"Penguin Books Ltd; Repack edition (February 1, 1996)",English,4.4 x 0.8 x 7.1 inches,5.6 ounces,4.4 out of 5 stars
"Buddhism: Beginner’s Guide to Understanding & Practicing Buddhism to Become Stress and Anxiety Free (Buddhism, Mindfulness, Meditation, Buddhism For Beginners) Paperback – September 29, 2016",$12.57 ,Books > Literature & Fiction > History & Criticism,Michael Williams,1537410008,208 pages,"CreateSpace Independent Publishing Platform (September 29, 2016)",English,6 x 0.5 x 9 inches,7 ounces,4.3 out of 5 stars
"The Doors of Perception and Heaven and Hell Paperback – July 28, 2009",$8.87 ,Books > Literature & Fiction > Essays & Correspondence,Aldous Huxley,61729078,208 pages,"Harper Perennial Modern Classics (July 28, 2009)",English,5.3 x 0.5 x 8 inches,8 ounces,4.2 out of 5 stars
"Now That You Mention It: A Novel Paperback – December 26, 2017",$10.70 ,Books > Literature & Fiction > Genre Fiction,Kristan Higgins,1335903356,416 pages,"HQN (December 26, 2017)",English,5.2 x 1 x 8 inches,10.6 ounces,4.7 out of 5 stars
"The Night Trilogy: Night, Dawn, Day Paperback – April 15, 2008",$9.79 ,Books > Biographies & Memoirs > Historical,Elie Wiesel,809073641,352 pages,"Hill and Wang; First PB Edition, First Printing edition (April 15, 2008)",English,5.5 x 0.9 x 8.3 inches,8.8 ounces,4.6 out of 5 stars
"The Little Paris Bookshop: A Novel Paperback – March 22, 2016",$11.70 ,Books > Literature & Fiction > History & Criticism,Nina George,553418793,416 pages,"Broadway Books; Reprint edition (March 22, 2016)",English,5.2 x 0.9 x 7.9 inches,9.4 ounces,4.0 out of 5 stars
"Shroud of Eternity: Sister of Darkness: The Nicci Chronicles, Volume II Hardcover – January 9, 2018",$19.49 ,Books > Literature & Fiction > Action & Adventure,Terry Goodkind,765388243,528 pages,"Tor Books; First Edition edition (January 9, 2018)",English,6.5 x 1.6 x 9.5 inches,3.4 pounds,4.0 out of 5 stars
"The Tower of Swallows (The Witcher) Paperback – May 17, 2016",$10.87 ,Books > Literature & Fiction > Action & Adventure,Andrzej SapkowskiDavid French,316273716,464 pages,"Orbit (May 17, 2016)",English,5.5 x 1.2 x 8.2 inches,14.4 ounces,4.5 out of 5 stars
"See Me Mass Market Paperback – May 30, 2017",$6.79 ,Books > Literature & Fiction > Genre Fiction,Nicholas Sparks,1455520608,576 pages,"Vision; Reprint edition (May 30, 2017)",English,4.2 x 1.2 x 6.9 inches,9.1 ounces,4.4 out of 5 stars
"Love is a Dog From Hell Paperback – May 31, 2002",$11.98 ,Books > Literature & Fiction > Poetry,Charles Bukowski,876853629,312 pages,"Ecco; Ecco edition (May 31, 2002)",English,5.9 x 0.8 x 8.9 inches,11.2 ounces,4.4 out of 5 stars
"Nineteen Minutes Paperback – February 5, 2008",$10.77 ,Books > Literature & Fiction > Genre Fiction,Jodi Picoult,743496736,455 pages,"Washington Square Press; 1ST edition (February 5, 2008)",English,5.3 x 1.2 x 8.2 inches,13.6 ounces,4.5 out of 5 stars
"My Not So Perfect Life: A Novel Paperback – July 11, 2017",$11.17 ,Books > Literature & Fiction > Women's Fiction,Sophie Kinsella,812987713,464 pages,"Dial Press Trade Paperback; Reprint edition (July 11, 2017)",English,5.1 x 0.9 x 8 inches,12 ounces,4.4 out of 5 stars
"Warbreaker Mass Market Paperback – March 30, 2010",$8.99 ,Books > Science Fiction & Fantasy > Fantasy,Brandon Sanderson,765360039,688 pages,"Tor Fantasy; Reissue edition (March 30, 2010)",English,4.3 x 1.1 x 6.9 inches,11.2 ounces,4.5 out of 5 stars
"Fablehaven Paperback – April 24, 2007",$7.85 ,Books > Teen & Young Adult > Literature & Fiction,Brandon Mull,1416947205,384 pages,"Aladdin; Reprint edition (April 24, 2007)",English,5.1 x 1 x 7.6 inches,8 ounces,4.7 out of 5 stars
"20,000 Leagues Under the Sea (Wordsworth Classics) Paperback – January 1, 1998",$3.58 ,Books > Literature & Fiction > Classics,Jules Verne,1853260312,256 pages,"Wordsworth Editions Ltd (January 1, 1998)",English,5.2 x 0.5 x 8 inches,4 ounces,4.2 out of 5 stars
"1637: The Volga Rules (Ring of Fire) Hardcover – February 6, 2018",$16.51 ,Books > Science Fiction & Fantasy > Science Fiction,Gorg Huff,148148303X,368 pages,"Baen; First Edition edition (February 6, 2018)",English,6.1 x 1.3 x 9.2 inches,1.2 pounds,4.5 out of 5 stars
"Vengeful (Villains) Hardcover – September 25, 2018",$21.90 ,Books > Science Fiction & Fantasy > Fantasy,V. E. Schwab,765387522,400 pages,"Tor Books (September 25, 2018)",English,5.4 x 8.2 inches,1.7 pounds,
"The Blood Mirror (Lightbringer) Paperback – July 18, 2017",$11.55 ,Books > Literature & Fiction > Action & Adventure,Brent Weeks,316251321,736 pages,"Orbit; Reprint edition (July 18, 2017)",English,5.6 x 2 x 8.4 inches,1.3 pounds,4.3 out of 5 stars
"Doctor Who: A Brief History of Time Lords Hardcover – June 6, 2017",$10.99 ,Books > Humor & Entertainment > Television,Steve Tribe,006266686X,160 pages,"Harper Design (June 6, 2017)",English,6 x 0.6 x 8.2 inches,1 pounds,4.6 out of 5 stars
"Sekret Machines Book 1: Chasing Shadows Paperback – February 28, 2017",$13.55 ,"Books > Mystery, Thriller & Suspense > Thrillers & Suspense",Tom DeLongeAJ Hartley,1943272298,704 pages,"To the Stars; Reprint edition (February 28, 2017)",English,5.5 x 1.7 x 8.2 inches,1.8 pounds,4.4 out of 5 stars
"The Trouble with Twelfth Grave: A Charley Davidson Novel (Charley Davidson Series) Mass Market Paperback – February 27, 2018",$8.99 ,"Books > Mystery, Thriller & Suspense > Mystery",Darynda Jones,1250147565,304 pages,"St. Martin's Paperbacks (February 27, 2018)",English,4.4 x 0.8 x 6.9 inches,5.1 ounces,4.7 out of 5 stars
"The Sandman, Vol. 3: Dream Country Paperback – October 19, 2010",$13.59 ,Books > Comics & Graphic Novels > Graphic Novels,Neil Gaiman,1401229352,160 pages,"Vertigo (October 19, 2010)",English,6.6 x 0.3 x 10.2 inches,9.6 ounces,4.5 out of 5 stars
"The Quantum Spy: A Thriller Hardcover – November 7, 2017",$14.11 ,"Books > Mystery, Thriller & Suspense > Thrillers & Suspense",David Ignatius,393254151,336 pages,"W. W. Norton & Company; 1 edition (November 7, 2017)",English,6.5 x 1.1 x 9.6 inches,1.6 pounds,4.1 out of 5 stars
"15th Affair (Women's Murder Club) Mass Market Paperback – May 30, 2017",$8.49 ,"Books > Mystery, Thriller & Suspense > Thrillers & Suspense",James Patterson,1455585289,400 pages,"Grand Central Publishing (May 30, 2017)",English,4.2 x 1 x 7.5 inches,7.8 ounces,4.5 out of 5 stars
"Overkill: An Alex Hawke Novel (Alex Hawke Novels) Hardcover – May 1, 2018",$25.19 ,Books > Literature & Fiction > Action & Adventure,Ted Bell,62684515,496 pages,"William Morrow (May 1, 2018)",English,6 x 1.5 x 9 inches,1.4 pounds,
"Act of Treason (A Mitch Rapp Novel) Mass Market Paperback – August 28, 2007",$8.99 ,"Books > Mystery, Thriller & Suspense > Thrillers & Suspense",Vince Flynn,1416542264,512 pages,"Pocket Books; Reprint edition (August 28, 2007)",English,4.1 x 1.1 x 7.5 inches,8.8 ounces,4.7 out of 5 stars
"Lethal Licorice (An Amish Candy Shop Mystery) Mass Market Paperback – February 27, 2018",$6.47 ,"Books > Mystery, Thriller & Suspense > Mystery",Amanda Flower,1496706412,352 pages,"Kensington (February 27, 2018)",English,4.2 x 0.9 x 6.8 inches,5.6 ounces,4.8 out of 5 stars
"Trophy Hunt (A Joe Pickett Novel) Paperback – July 5, 2016",$8.99 ,"Books > Mystery, Thriller & Suspense > Thrillers & Suspense",C. J. Box,399575715,416 pages,"G.P. Putnam's Sons; Premium edition (July 5, 2016)",English,4.3 x 0.8 x 7.5 inches,3.2 ounces,4.5 out of 5 stars
"Something Wicked This Way Comes: A Novel Paperback – October 24, 2017",$10.99 ,"Books > Mystery, Thriller & Suspense > Thrillers & Suspense",Ray Bradbury,1501167715,352 pages,"Simon & Schuster; Reprint edition (October 24, 2017)",English,5.5 x 0.9 x 8.4 inches,9.6 ounces,4.2 out of 5 stars
"The Money Shot (A Teddy Fay Novel) Hardcover – August 7, 2018",$25.20 ,Books > Literature & Fiction > Action & Adventure,Stuart Woods,735218595,320 pages,"G.P. Putnam's Sons (August 7, 2018)",English,6 x 1 x 9 inches,1.2 pounds,
"Closer Than You Know: A Novel Hardcover – March 6, 2018",$15.79 ,"Books > Mystery, Thriller & Suspense > Thrillers & Suspense",Brad Parks,1101985623,416 pages,"Dutton (March 6, 2018)",English,6.4 x 1.4 x 9.3 inches,1.3 pounds,4.7 out of 5 stars
"Stalking Jack the Ripper Hardcover – September 20, 2016",$10.96 ,Books > Teen & Young Adult > Science Fiction & Fantasy,Kerri Maniscalco,031627349X,336 pages,"jimmy patterson (September 20, 2016)",English,6.5 x 1 x 9.2 inches,14.1 ounces,4.2 out of 5 stars
"Theodore Boone Box Set (Kid Lawyer / The Abduction / The Accused / The Activist) Paperback – May 19, 2015",$22.37 ,Books > Children's Books > Action & Adventure,John Grisham,147514444,1152 pages,"Puffin Books; Deluxe edition (May 19, 2015)",English,5.2 x 3.2 x 7.9 inches,1.9 pounds,4.2 out of 5 stars
"Executive Power (A Mitch Rapp Novel) Mass Market Paperback – May 25, 2010",$8.75 ,"Books > Mystery, Thriller & Suspense > Thrillers & Suspense",Vince Flynn,143918965X,544 pages,"Pocket Books (May 25, 2010)",English,4.1 x 1.1 x 7.5 inches,4 ounces,4.6 out of 5 stars
"Deep Freeze (A Virgil Flowers Novel) Hardcover – October 17, 2017",$13.00 ,"Books > Mystery, Thriller & Suspense > Thrillers & Suspense",John Sandford,399176063,400 pages,"G.P. Putnam's Sons; 1st Edition edition (October 17, 2017)",English,6.4 x 1.5 x 9.3 inches,1.3 pounds,4.6 out of 5 stars
"I Could Pee on This: And Other Poems by Cats Hardcover – August 15, 2012",$10.36 ,Books > Humor & Entertainment > Humor,Francesco Marciuliano,1452110581,112 pages,"Chronicle Books; First Printing edition (August 15, 2012)",English,5 x 0.5 x 6.2 inches,8.5 ounces,4.6 out of 5 stars
"From a Certain Point of View (Star Wars) Hardcover – October 3, 2017",$20.11 ,Books > Literature & Fiction > Action & Adventure,John Jackson Miller,345511476,496 pages,"Del Rey (October 3, 2017)",English,6.3 x 1.5 x 8.3 inches,1.4 pounds,4.0 out of 5 stars
"The Chilbury Ladies' Choir: A Novel Paperback – September 5, 2017",$10.59 ,Books > Literature & Fiction > Genre Fiction,Jennifer Ryan,1101906774,416 pages,"Broadway Books; Reprint edition (September 5, 2017)",English,5.2 x 0.9 x 8 inches,10.6 ounces,4.4 out of 5 stars
A Confederacy of Dunces Paperback – 1987,$9.84 ,Books > Literature & Fiction > Humor & Satire,John Kennedy Toole,802130208,405 pages,Grove Weidenfeld; Reissue edition (1987),English,5.2 x 1 x 8.2 inches,11.2 ounces,4.2 out of 5 stars
"Cutting for Stone Paperback – January 26, 2010",$10.00 ,Books > Literature & Fiction > Genre Fiction,Abraham Verghese,375714367,667 pages,"Vintage Books; 1st edition (January 26, 2010)",English,5.2 x 1.2 x 8 inches,1.2 pounds,4.6 out of 5 stars
"Long-Distance Real Estate Investing: How to Buy, Rehab, and Manage Out-of-State Rental Properties Paperback – December 14, 2017",$16.37 ,Books > Business & Money > Real Estate,David Greene,997584750,285 pages,"BiggerPockets (December 14, 2017)",English,6 x 0.8 x 9 inches,13.9 ounces,4.9 out of 5 stars
"The Invention of Wings Paperback – May 5, 2015",$11.08 ,Books > Literature & Fiction > Genre Fiction,Sue Monk Kidd,143121707,384 pages,"Penguin Books; Reprint edition (May 5, 2015)",English,5.2 x 0.7 x 7.8 inches,9.6 ounces,4.7 out of 5 stars
"A Knight of the Seven Kingdoms (A Song of Ice and Fire) Hardcover – October 6, 2015",$20.40 ,Books > Literature & Fiction > Action & Adventure,George R. R. Martin,345533488,368 pages,"Bantam; 1st edition (October 6, 2015)",English,6.4 x 1.3 x 9.5 inches,2.2 pounds,4.4 out of 5 stars
"A Dance with Dragons (A Song of Ice and Fire) Mass Market Paperback – October 29, 2013",$7.99 ,Books > Literature & Fiction > Action & Adventure,George R. R. Martin,553582011,1152 pages,"Bantam; Reprint edition (October 29, 2013)",English,4.2 x 1.8 x 6.9 inches,1 pounds,4.3 out of 5 stars
"The Girl Before: A Novel Paperback – January 2, 2018",$10.77 ,"Books > Mystery, Thriller & Suspense > Thrillers & Suspense",JP Delaney,425285065,368 pages,"Ballantine Books; Reprint edition (January 2, 2018)",English,5.5 x 0.8 x 8.2 inches,10.2 ounces,4.0 out of 5 stars
"Como agua para chocolate (Spanish Edition) (Spanish) Paperback – January 25, 2001",$13.47 ,Books > Literature & Fiction > Genre Fiction,Laura Esquivel,385721234,256 pages,"Vintage Espanol; unknown edition (January 25, 2001)",Spanish,5.2 x 0.6 x 8 inches,8 ounces,4.5 out of 5 stars
"The Lion, the Witch and the Wardrobe (Annotated) (The Chronicles of Narnia) Paperback – February 25, 2018",$5.42 ,Books > Science Fiction & Fantasy > Fantasy,C.S. Lewis,1980395802,100 pages,"Independently published (February 25, 2018)",English,8.5 x 0.2 x 11 inches,11.2 ounces,4.7 out of 5 stars
"Dark Disciple: Star Wars Paperback – March 1, 2016",$8.99 ,Books > Literature & Fiction > Genre Fiction,Christie Golden,1101884959,400 pages,"Del Rey; Reissue edition (March 1, 2016)",English,4.1 x 1 x 7.5 inches,12.6 ounces,4.5 out of 5 stars
"Frankenstein: Annotated for Scientists, Engineers, and Creators of All Kinds (MIT Press) Paperback – May 5, 2017",$16.12 ,Books > Literature & Fiction > Genre Fiction,David H. GustonEd Finn,262533286,320 pages,"The MIT Press; Annotated edition (May 5, 2017)",English,6.5 x 0.8 x 9 inches,1.1 pounds,3.7 out of 5 stars
"Gravity's Rainbow (Penguin Classics Deluxe Edition) Paperback – Deckle Edge, October 31, 2006",$14.93 ,Books > Science Fiction & Fantasy > Science Fiction,Thomas Pynchon,143039946,776 pages,"Penguin Classics; Deluxe edition (October 31, 2006)",English,5.6 x 1.3 x 8.3 inches,2 pounds,3.7 out of 5 stars
"Berserk, Vol. 6 Paperback – February 1, 2005",$11.67 ,Books > Comics & Graphic Novels > Manga,Kentaro Miura,159307252X,240 pages,"Dark Horse Manga (February 1, 2005)",English,5.1 x 0.7 x 7.3 inches,6.4 ounces,4.7 out of 5 stars
"That Hideous Strength (Space Trilogy, Book 3) Paperback – May 13, 2003",$12.63 ,Books > Christian Books & Bibles > Literature & Fiction,C.S. Lewis,743234928,384 pages,"Scribner; Reprint edition (May 13, 2003)",English,5.2 x 0.8 x 8 inches,4 ounces,4.4 out of 5 stars
"Dragons of Autumn Twilight (Dragonlance Chronicles, Volume I) Mass Market Paperback – February 1, 2000",$7.99 ,Books > Literature & Fiction > Action & Adventure,Margaret WeisTracy Hickman,786915749,448 pages,"Wizards of the Coast; Reissue edition (February 1, 2000)",English,4.2 x 1.2 x 6.9 inches,8 ounces,4.6 out of 5 stars
"Pathfinder Roleplaying Game: Advanced Player’s Guide Hardcover – July 19, 2016",$30.57 ,Books > Science Fiction & Fantasy > Gaming,Jason Bulmahn,1601252463,320 pages,"Paizo Inc.; 2nd Printing edition (July 19, 2016)",English,8.5 x 0.9 x 10.9 inches,2.6 pounds,4.7 out of 5 stars
"Y: The Last Man Book One Paperback – September 16, 2014",$12.93 ,Books > Comics & Graphic Novels > Graphic Novels,Brian K. Vaughan,140125151X,256 pages,"Vertigo (September 16, 2014)",English,6.6 x 0.6 x 10.2 inches,14.9 ounces,4.5 out of 5 stars
"Snow Flower and the Secret Fan: A Novel Paperback – Deckle Edge, May 26, 2009",$14.53 ,Books > Literature & Fiction > Genre Fiction,Lisa See,812980352,288 pages,"Random House Trade Paperbacks; Reprint edition (May 26, 2009)",English,5.7 x 0.7 x 8.2 inches,9.9 ounces,4.6 out of 5 stars
"Order to Kill: A Novel (A Mitch Rapp Novel) Mass Market Paperback – July 18, 2017",$7.02 ,"Books > Mystery, Thriller & Suspense > Thrillers & Suspense",Vince FlynnKyle Mills,1476783497,448 pages,"Pocket Books; Reprint edition (July 18, 2017)",English,4.1 x 0.9 x 7.5 inches,8.2 ounces,4.5 out of 5 stars
"The Silent Sister: A Novel Paperback – October 6, 2015",$9.98 ,Books > Literature & Fiction > Women's Fiction,Diane Chamberlain,1250074355,368 pages,"St. Martin's Griffin; Reprint edition (October 6, 2015)",English,5.5 x 0.9 x 8.1 inches,12.6 ounces,4.4 out of 5 stars
"A is for Alibi (Kinsey Millhone Alphabet Mysteries, No. 1) Paperback – September 30, 2008",$14.57 ,"Books > Mystery, Thriller & Suspense > Mystery",Sue Grafton,312353812,320 pages,"St. Martin's Griffin; Reprint edition (November 29, 2005)",English,5.5 x 0.9 x 8.3 inches,1 pounds,4.1 out of 5 stars
"Echoes in Death: An Eve Dallas Novel (In Death, Book 44) Mass Market Paperback – August 1, 2017",$6.39 ,"Books > Mystery, Thriller & Suspense > Thrillers & Suspense",J. D. Robb,1250123135,416 pages,"St. Martin's Paperbacks; Reissue edition (August 1, 2017)",English,4.1 x 1.1 x 6.8 inches,8.8 ounces,4.8 out of 5 stars
"1st to Die (Women's Murder Club) Paperback – May 20, 2005",$9.28 ,"Books > Mystery, Thriller & Suspense > Mystery",James Patterson,446696617,432 pages,"Grand Central Publishing; Women's Murder Club edition (May 20, 2005)",English,5.2 x 1.1 x 8 inches,12.8 ounces,4.5 out of 5 stars
"The Atlantis World (The Origin Mystery, Book 3) Paperback – May 15, 2014",$12.99 ,Books > Science Fiction & Fantasy > Science Fiction,A.G. Riddle,1940026067,304 pages,"Riddle Inc.; 1st edition (May 15, 2014)",English,6 x 0.8 x 9 inches,1.2 pounds,4.3 out of 5 stars
"The Wettest County in the World: A Novel Based on a True Story Paperback – December 29, 2009",$9.86 ,"Books > Reference > Writing, Research & Publishing Guides",Matt Bondurant,1416561404,312 pages,"Scribner; Reprint edition (December 29, 2009)",English,5.5 x 0.9 x 8.4 inches,8 ounces,4.2 out of 5 stars
"Dragonfly in Amber: A Novel (Outlander) Mass Market Paperback – November 2, 1993",$7.99 ,Books > Literature & Fiction > Genre Fiction,Diana Gabaldon,440215625,976 pages,"Dell; Reprint edition (November 2, 1993)",English,4.2 x 1.5 x 6.9 inches,1 pounds,4.6 out of 5 stars
"Different Seasons: Four Novellas Paperback – March 29, 2016",$10.87 ,"Books > Mystery, Thriller & Suspense > Thrillers & Suspense",Stephen King,1501143484,608 pages,"Scribner; Reprint edition (March 29, 2016)",English,5.5 x 1.5 x 8.4 inches,1.2 pounds,4.5 out of 5 stars
"A Visit from the Goon Squad Paperback – March 22, 2011",$13.52 ,Books > Literature & Fiction > Genre Fiction,Jennifer Egan,307477479,352 pages,"Anchor; 1 edition (March 22, 2011)",English,5.2 x 0.7 x 8 inches,12 ounces,3.6 out of 5 stars
"The Coldest Winter Ever Mass Market Paperback – February 1, 2006",$7.19 ,Books > Literature & Fiction > United States,Sister Souljah,1416521690,544 pages,"Pocket Star (February 1, 2006)",English,4.2 x 1.1 x 6.8 inches,9.6 ounces,4.6 out of 5 stars
"The Hamilton Affair: A Novel Paperback – June 6, 2017",$10.57 ,Books > Literature & Fiction > Genre Fiction,Elizabeth Cobbs,1628728558,433 pages,"Arcade Publishing; Reprint edition (June 6, 2017)",English,5.5 x 1 x 8 inches,1 pounds,4.5 out of 5 stars
"The Help Paperback – April 5, 2011",$10.16 ,Books > Literature & Fiction > United States,Kathryn Stockett,425232204,544 pages,"Berkley; Reprint edition (April 5, 2011)",English,5 x 1.1 x 8.2 inches,10.4 ounces,4.7 out of 5 stars
"Sweetbitter Paperback – April 4, 2017",$11.00 ,Books > Literature & Fiction > Genre Fiction,Stephanie Danler,1101911867,356 pages,"Vintage; Reprint edition (April 4, 2017)",English,5.2 x 0.8 x 8 inches,4.8 ounces,3.1 out of 5 stars
"Edgedancer: From the Stormlight Archive Hardcover – October 17, 2017",$8.97 ,Books > Literature & Fiction > Action & Adventure,Brandon Sanderson,1250166543,272 pages,"Tor Books; F First Edition edition (October 17, 2017)",English,4.6 x 1 x 7 inches,10.1 ounces,4.6 out of 5 stars
"Mr. Brown Can Moo! Can You? Hardcover – August 12, 1970",$6.00 ,Books > Children's Books > Literature & Fiction,Dr. Seuss,1299612393,36 pages,"Random House (August 12, 1970)",English,6.8 x 0.3 x 9.3 inches,6.4 ounces,4.7 out of 5 stars
"Three Wishes: A Novel Mass Market Paperback – February 28, 2017",$6.79 ,Books > Literature & Fiction > Genre Fiction,Liane Moriarty,62669257,464 pages,"Harper; Reprint edition (February 28, 2017)",English,4.2 x 1.2 x 6.8 inches,7.2 ounces,4.1 out of 5 stars
"Grendel Paperback – May 14, 1989",$10.35 ,Books > Literature & Fiction > Poetry,John Gardner,679723110,192 pages,"Vintage (May 14, 1989)",English,5.2 x 0.5 x 8 inches,7.2 ounces,4.1 out of 5 stars
"Star Trek: Light-Up Starship Enterprise (Miniature Editions) Book Supplement – March 25, 2014",$11.66 ,Books > Humor & Entertainment > Humor,Chip Carter,762449896,,"Running Press Miniature Editions; Box Mac to edition (March 25, 2014)",English,2 x 3.9 x 3 inches,2.1 ounces,4.6 out of 5 stars
"Is It Wrong to Try to Pick Up Girls in a Dungeon? On the Side: Sword Oratoria, Vol. 5 (light novel) Paperback – February 27, 2018",$14.00 ,Books > Comics & Graphic Novels > Manga,Fujino Omori,031644250X,232 pages,"Yen On (February 27, 2018)",English,5.5 x 0.6 x 8.2 inches,8.5 ounces,4.7 out of 5 stars
"Enforcing Home (The Survivalist) (Volume 6) Paperback – August 16, 2015",$14.99 ,Books > Science Fiction & Fantasy > Science Fiction,A American,996696008,348 pages,"Angery American Enterprises Inc.; 1 edition (August 16, 2015)",English,5 x 0.8 x 8 inches,12.6 ounces,4.7 out of 5 stars
"Wheel of Time, Boxed Set IV: Crossroads of Twilight, Knife of Dreams, Gathering Storm Mass Market Paperback – November 1, 2011",$16.99 ,Books > Literature & Fiction > Action & Adventure,Robert Jordan,765368617,,"Tor Fantasy; 1 edition (November 1, 2011)",English,4.2 x 4.6 x 6.8 inches,3 pounds,4.6 out of 5 stars
"A Wild Sheep Chase: A Novel Paperback – April 9, 2002",$10.87 ,"Books > Mystery, Thriller & Suspense > Mystery",Haruki MurakamiAlfred Birnbaum,037571894X,353 pages,"Vintage (April 9, 2002)",English,5.2 x 0.7 x 8 inches,9.9 ounces,4.3 out of 5 stars
"Is It Wrong to Try to Pick Up Girls in a Dungeon?, Vol. 10 (light novel) (Is It Wrong to Pick Up Girls in a Dungeon?) Paperback – December 19, 2017",$9.80 ,Books > Science Fiction & Fantasy > Fantasy,Fujino Omori,316442453,304 pages,"Yen On (December 19, 2017)",English,5.5 x 0.8 x 8.2 inches,10.7 ounces,4.6 out of 5 stars
"The Dragon Reborn (The Wheel of Time, Book 3) Mass Market Paperback – October 15, 1992",$7.99 ,Books > Literature & Fiction > Action & Adventure,Robert Jordan,812513711,704 pages,"Tor Fantasy (October 15, 1992)",English,4.1 x 1.5 x 6.8 inches,8 ounces,4.6 out of 5 stars
"We Paperback – August 1, 1993",$12.75 ,Books > Science Fiction & Fantasy > Science Fiction,Yevgeny ZamyatinClarence Brown,140185852,221 pages,"Penguin Twentieth Century Classics (August 1, 1993)",English,5 x 0.4 x 7.7 inches,5.6 ounces,4.0 out of 5 stars
"Fool Moon (Dresden Files) Mass Market Paperback – January 1, 2001",$8.87 ,"Books > Mystery, Thriller & Suspense > Mystery",Jim Butcher,451458125,432 pages,"Roc; English Language edition (January 1, 2001)",English,4.3 x 0.9 x 7.5 inches,4 ounces,4.5 out of 5 stars
"The Little Stranger Paperback – May 4, 2010",$13.60 ,Books > Literature & Fiction > Genre Fiction,Sarah Waters,1594484465,528 pages,"Riverhead Books; Reprint edition (May 4, 2010)",English,5.2 x 1.1 x 8 inches,1 pounds,3.6 out of 5 stars
"Razor Girl: A novel Paperback – May 2, 2017",$12.76 ,"Books > Mystery, Thriller & Suspense > Mystery",Carl Hiaasen,345804902,400 pages,"Vintage Crime/Black Lizard; Reprint edition (May 2, 2017)",English,5.2 x 0.8 x 8 inches,10.4 ounces,4.2 out of 5 stars
"The Passage: A Novel (Book One of The Passage Trilogy) Paperback – May 17, 2011",$14.32 ,"Books > Mystery, Thriller & Suspense > Thrillers & Suspense",Justin Cronin,345504976,785 pages,"Ballantine Books; Reprint edition (May 17, 2011)",English,5.5 x 1.3 x 8.2 inches,3.2 pounds,4.2 out of 5 stars
"Pekoe Most Poison (A Tea Shop Mystery) Mass Market Paperback – February 6, 2018",$7.99 ,"Books > Mystery, Thriller & Suspense > Mystery",Laura Childs,425281698,320 pages,"Berkley; Reissue edition (February 6, 2018)",English,4.2 x 0.8 x 6.8 inches,5.4 ounces,4.3 out of 5 stars
